{"$schema":"https://json-schema.org/draft/2020-12/schema","$id":"https://axignal.com/schemas/intent-intelligence-knowledge-tides-fixtures.schema.json","title":"AXIGNAL P18 Conformance Fixture Matrix","type":"object","additionalProperties":false,"required":["schema_version","task_id","groups","expected_fixture_count"],"properties":{"schema_version":{"const":"axignal.intent-intelligence-fixtures/v0.1"},"task_id":{"const":"AX-GE2E-P18-T01"},"expected_fixture_count":{"const":40},"groups":{"type":"array","minItems":8,"maxItems":8,"items":{"type":"object","additionalProperties":false,"required":["module_id","cases"],"properties":{"module_id":{"type":"string"},"cases":{"type":"array","minItems":5,"maxItems":5,"items":{"type":"object","additionalProperties":false,"required":["class_id","input","expected_decision"],"properties":{"class_id":{"type":"string"},"input":{"type":"object"},"expected_decision":{"type":"string"}}}}}}}}}
