{"schema_version":"axignal.intent-intelligence-fixtures/v0.1","task_id":"AX-GE2E-P18-T01","groups":[{"module_id":"INTENT_EVENT_GATE","cases":[{"class_id":"VALID_AGGREGATE","input":{"aggregate_tides":true,"private_memory":false,"deleted":false,"bot_or_internal":false,"direct_identifier":false},"expected_decision":"ALLOW_AGGREGATE"},{"class_id":"VALID_PRIVATE","input":{"aggregate_tides":false,"private_memory":true,"deleted":false,"bot_or_internal":false,"direct_identifier":false},"expected_decision":"ALLOW_PRIVATE"},{"class_id":"DELETED","input":{"aggregate_tides":true,"private_memory":true,"deleted":true,"bot_or_internal":false,"direct_identifier":false},"expected_decision":"DENY"},{"class_id":"INTERNAL","input":{"aggregate_tides":true,"private_memory":false,"deleted":false,"bot_or_internal":true,"direct_identifier":false},"expected_decision":"DENY"},{"class_id":"DIRECT_IDENTIFIER","input":{"aggregate_tides":true,"private_memory":false,"deleted":false,"bot_or_internal":false,"direct_identifier":true},"expected_decision":"DENY"}]},{"module_id":"PURPOSE_CONSENT_LEDGER","cases":[{"class_id":"EXPLICIT_ALLOW","input":{"requested_purpose":"aggregate_tides","permission":true,"revoked":false,"implied":false},"expected_decision":"ALLOW"},{"class_id":"EXPLICIT_DENY","input":{"requested_purpose":"aggregate_tides","permission":false,"revoked":false,"implied":false},"expected_decision":"DENY"},{"class_id":"REVOKED","input":{"requested_purpose":"private_memory","permission":true,"revoked":true,"implied":false},"expected_decision":"DENY"},{"class_id":"IMPLIED","input":{"requested_purpose":"model_evaluation","permission":true,"revoked":false,"implied":true},"expected_decision":"DENY"},{"class_id":"WRONG_PURPOSE","input":{"requested_purpose":"aggregate_tides","permission":false,"revoked":false,"implied":false},"expected_decision":"DENY"}]},{"module_id":"PRIVATE_PREFERENCE_MEMORY","cases":[{"class_id":"OBSERVED","input":{"memory_enabled":true,"deleted":false,"repetitions":1,"distinct_days":1,"user_confirmed":false},"expected_decision":"OBSERVED_INTEREST"},{"class_id":"INFERRED","input":{"memory_enabled":true,"deleted":false,"repetitions":3,"distinct_days":2,"user_confirmed":false},"expected_decision":"INFERRED_PREFERENCE"},{"class_id":"CONFIRMED","input":{"memory_enabled":true,"deleted":false,"repetitions":1,"distinct_days":1,"user_confirmed":true},"expected_decision":"CONFIRMED_PREFERENCE"},{"class_id":"MEMORY_DISABLED","input":{"memory_enabled":false,"deleted":false,"repetitions":5,"distinct_days":4,"user_confirmed":false},"expected_decision":"DENY"},{"class_id":"DELETED","input":{"memory_enabled":true,"deleted":true,"repetitions":5,"distinct_days":4,"user_confirmed":true},"expected_decision":"DELETE"}]},{"module_id":"COHORT_PRIVACY_AGGREGATOR","cases":[{"class_id":"VALID","input":{"unique_users":30,"unique_organisations":8,"dominant_organisation_share":0.2,"active_days":5,"reidentification_risk":"LOW","row_level_output":false},"expected_decision":"AGGREGATE_ALLOWED"},{"class_id":"SMALL_USERS","input":{"unique_users":19,"unique_organisations":8,"dominant_organisation_share":0.2,"active_days":5,"reidentification_risk":"LOW","row_level_output":false},"expected_decision":"PRIVACY_SUPPRESSED"},{"class_id":"SMALL_ORGS","input":{"unique_users":30,"unique_organisations":4,"dominant_organisation_share":0.2,"active_days":5,"reidentification_risk":"LOW","row_level_output":false},"expected_decision":"PRIVACY_SUPPRESSED"},{"class_id":"DOMINANT_ORG","input":{"unique_users":30,"unique_organisations":8,"dominant_organisation_share":0.3,"active_days":5,"reidentification_risk":"LOW","row_level_output":false},"expected_decision":"PRIVACY_SUPPRESSED"},{"class_id":"ROW_LEVEL","input":{"unique_users":30,"unique_organisations":8,"dominant_organisation_share":0.2,"active_days":5,"reidentification_risk":"LOW","row_level_output":true},"expected_decision":"DENY"}]},{"module_id":"KNOWLEDGE_TIDE_ENGINE","cases":[{"class_id":"EMERGING","input":{"privacy_allowed":true,"cohort_sufficient":true,"intent_share":0.05,"intent_velocity":0.05,"persistence":0.3,"organisation_diversity":0.4,"manipulation_risk":0.1},"expected_decision":"EMERGING_ATTENTION"},{"class_id":"ACCELERATING","input":{"privacy_allowed":true,"cohort_sufficient":true,"intent_share":0.08,"intent_velocity":0.3,"persistence":0.4,"organisation_diversity":0.5,"manipulation_risk":0.1},"expected_decision":"ACCELERATING_ATTENTION"},{"class_id":"PERSISTENT","input":{"privacy_allowed":true,"cohort_sufficient":true,"intent_share":0.12,"intent_velocity":0.02,"persistence":0.8,"organisation_diversity":0.5,"manipulation_risk":0.1},"expected_decision":"PERSISTENT_ATTENTION"},{"class_id":"DECLINING","input":{"privacy_allowed":true,"cohort_sufficient":true,"intent_share":0.1,"intent_velocity":-0.2,"persistence":0.5,"organisation_diversity":0.5,"manipulation_risk":0.1},"expected_decision":"DECLINING_ATTENTION"},{"class_id":"SUPPRESSED","input":{"privacy_allowed":false,"cohort_sufficient":false,"intent_share":0.5,"intent_velocity":0.5,"persistence":1.0,"organisation_diversity":1.0,"manipulation_risk":0.0},"expected_decision":"PRIVACY_SUPPRESSED"}]},{"module_id":"MANIPULATION_BIAS_DEFENCE","cases":[{"class_id":"CLEAR","input":{"bot_or_internal_share":0.0,"campaign_share":0.1,"dominant_organisation_share":0.2,"burst_score":0.2},"expected_decision":"CLEAR"},{"class_id":"BOT","input":{"bot_or_internal_share":0.2,"campaign_share":0.1,"dominant_organisation_share":0.2,"burst_score":0.2},"expected_decision":"COORDINATION_SUSPECTED"},{"class_id":"CAMPAIGN","input":{"bot_or_internal_share":0.0,"campaign_share":0.6,"dominant_organisation_share":0.2,"burst_score":0.2},"expected_decision":"COORDINATION_SUSPECTED"},{"class_id":"DOMINANT_ORG","input":{"bot_or_internal_share":0.0,"campaign_share":0.1,"dominant_organisation_share":0.4,"burst_score":0.2},"expected_decision":"COORDINATION_SUSPECTED"},{"class_id":"BURST","input":{"bot_or_internal_share":0.0,"campaign_share":0.1,"dominant_organisation_share":0.2,"burst_score":0.9},"expected_decision":"COORDINATION_SUSPECTED"}]},{"module_id":"RESEARCH_CANDIDATE_FACTORY","cases":[{"class_id":"PROPOSE","input":{"tide_state":"ACCELERATING_ATTENTION","privacy_scope":"GLOBAL_AGGREGATE","rights_confidence":0.9,"source_feasibility":0.8,"human_review_current":false},"expected_decision":"PROPOSED"},{"class_id":"READY_FOR_PRIORITY","input":{"tide_state":"PERSISTENT_ATTENTION","privacy_scope":"GLOBAL_AGGREGATE","rights_confidence":0.9,"source_feasibility":0.8,"human_review_current":true},"expected_decision":"PRIORITISATION_READY"},{"class_id":"PRIVACY_BLOCK","input":{"tide_state":"PRIVACY_SUPPRESSED","privacy_scope":"GLOBAL_AGGREGATE","rights_confidence":0.9,"source_feasibility":0.8,"human_review_current":true},"expected_decision":"PRIVACY_SUPPRESSED"},{"class_id":"RIGHTS_BLOCK","input":{"tide_state":"PERSISTENT_ATTENTION","privacy_scope":"GLOBAL_AGGREGATE","rights_confidence":0.5,"source_feasibility":0.8,"human_review_current":true},"expected_decision":"RIGHTS_BLOCKED"},{"class_id":"COORDINATION_BLOCK","input":{"tide_state":"COORDINATION_SUSPECTED","privacy_scope":"GLOBAL_AGGREGATE","rights_confidence":0.9,"source_feasibility":0.8,"human_review_current":true},"expected_decision":"MANIPULATION_SUSPECTED"}]},{"module_id":"RETENTION_DELETION_AUDIT","cases":[{"class_id":"RETAIN","input":{"deleted":false,"expired":false,"retention_class":"STANDARD","raw_content":false},"expected_decision":"RETAIN"},{"class_id":"DELETE","input":{"deleted":true,"expired":false,"retention_class":"STANDARD","raw_content":false},"expected_decision":"DELETE_AND_INVALIDATE"},{"class_id":"EXPIRE","input":{"deleted":false,"expired":true,"retention_class":"SHORT","raw_content":false},"expected_decision":"EXPIRE_AND_INVALIDATE"},{"class_id":"AUDIT_RAW_DENY","input":{"deleted":false,"expired":false,"retention_class":"AUDIT","raw_content":true},"expected_decision":"DENY"},{"class_id":"AUDIT_METADATA","input":{"deleted":false,"expired":false,"retention_class":"AUDIT","raw_content":false},"expected_decision":"RETAIN_METADATA_ONLY"}]}],"expected_fixture_count":40}
